{
  "schemaVersion": 1,
  "id": "java-module-check",
  "dayId": "F18",
  "kind": "moduleCheck",
  "formats": [
    "MCQ",
    "coding"
  ],
  "passMark": 70,
  "weights": {},
  "objectives": [
    "java-foundations/java-basics/primitive-types-and-variables#o2",
    "java-foundations/java-basics/if-else-and-switch#o3",
    "java-foundations/methods-and-recursion/method-overloading#o2",
    "java-foundations/methods-and-recursion/pass-by-value#o3",
    "java-foundations/methods-and-recursion/recursion-and-the-call-stack#o3",
    "java-foundations/arrays-lists-and-maps/linear-and-binary-search#o3",
    "java-foundations/arrays-lists-and-maps/hashmap-basics#o2",
    "java-foundations/classes-and-objects/access-modifiers#o2",
    "java-foundations/classes-and-objects/double-equals-vs-equals#o1",
    "java-foundations/inheritance-and-design/polymorphism-overriding-vs-overloading#o1",
    "java-foundations/inheritance-and-design/interfaces-and-default-methods#o2",
    "java-foundations/exceptions-and-logging/try-catch-finally-and-try-with-resources#o2",
    "java-foundations/http-and-javalin/http-methods-status-codes-and-json#o2",
    "java-foundations/http-and-javalin/routes-and-handlers-in-javalin#o1",
    "java-foundations/testing-and-java-review/mocking-with-mockito#o3",
    "java-foundations/classes-and-objects/encapsulation-with-getters-and-setters#o2",
    "java-foundations/exceptions-and-logging/custom-exceptions#o2",
    "java-foundations/testing-and-java-review/junit-test-first#o3"
  ],
  "objectiveFormats": {
    "java-foundations/java-basics/primitive-types-and-variables#o2": [
      "MCQ"
    ],
    "java-foundations/java-basics/if-else-and-switch#o3": [
      "MCQ"
    ],
    "java-foundations/methods-and-recursion/method-overloading#o2": [
      "MCQ"
    ],
    "java-foundations/methods-and-recursion/pass-by-value#o3": [
      "MCQ"
    ],
    "java-foundations/methods-and-recursion/recursion-and-the-call-stack#o3": [
      "MCQ"
    ],
    "java-foundations/arrays-lists-and-maps/linear-and-binary-search#o3": [
      "MCQ"
    ],
    "java-foundations/arrays-lists-and-maps/hashmap-basics#o2": [
      "MCQ"
    ],
    "java-foundations/classes-and-objects/access-modifiers#o2": [
      "MCQ"
    ],
    "java-foundations/classes-and-objects/double-equals-vs-equals#o1": [
      "MCQ"
    ],
    "java-foundations/inheritance-and-design/polymorphism-overriding-vs-overloading#o1": [
      "MCQ"
    ],
    "java-foundations/inheritance-and-design/interfaces-and-default-methods#o2": [
      "MCQ"
    ],
    "java-foundations/exceptions-and-logging/try-catch-finally-and-try-with-resources#o2": [
      "MCQ"
    ],
    "java-foundations/http-and-javalin/http-methods-status-codes-and-json#o2": [
      "MCQ"
    ],
    "java-foundations/http-and-javalin/routes-and-handlers-in-javalin#o1": [
      "MCQ"
    ],
    "java-foundations/testing-and-java-review/mocking-with-mockito#o3": [
      "MCQ"
    ],
    "java-foundations/classes-and-objects/encapsulation-with-getters-and-setters#o2": [
      "coding"
    ],
    "java-foundations/exceptions-and-logging/custom-exceptions#o2": [
      "coding"
    ],
    "java-foundations/testing-and-java-review/junit-test-first#o3": [
      "coding"
    ]
  },
  "itemCounts": {
    "MCQ": 15,
    "coding": 2
  },
  "durationMinutes": 45,
  "allowedResources": [
    "The frozen calendar states no AI or resource restriction for the F18 'Module check' block; any rule on AI assistants, notes, course pages or web documentation is set and shown by the platform assessment owner",
    "Coding part: the Java 25 and JUnit environment provided by the assessment platform"
  ],
  "instructions": "Java module check (Day F18). This check closes Java Foundations and takes 45 minutes in two parts. Part 1 is 15 multiple-choice questions, about 15 minutes. Part 2 is 2 short coding tasks, about 30 minutes: you complete a small Java class that rejects invalid input with a custom exception, and a JUnit test that checks it with assertThrows. The assessment platform shows which resources you may use. The pass mark is 70%."
}
